{
  "schemaVersion": 4,
  "contentVersion": 42,
  "implementedEffectRegistryVersion": 48,
  "source": "docs/design/Minecraft_Biome_Rivals_Prototype_Cards_v0.1.md",
  "entries": [
    {
      "id": "pf_001",
      "designId": "PF-001",
      "contentVersion": 41,
      "collectible": true,
      "manualPlayAllowed": true,
      "nameKey": "card.pf_001.name",
      "rulesTextKey": "card.pf_001.rules",
      "factionId": "plains_forest",
      "themeId": "plains_forest",
      "rarity": "COMMON",
      "cardType": "UNIT",
      "cost": 1,
      "hasAttack": true,
      "attack": 1,
      "hasHealth": true,
      "health": 2,
      "hasDurability": false,
      "durability": 0,
      "buildingSlots": 0,
      "artKey": "card_art.pf_001",
      "tags": [
        "arthropod",
        "animal"
      ],
      "keywords": [],
      "hasCraftingRecipe": false,
      "recipeId": "",
      "craftingRecipe": [],
      "craftedAttackBonus": 0,
      "craftedHealthBonus": 0,
      "craftedDurabilityBonus": 0,
      "effectImplementationStatus": "IMPLEMENTED",
      "effectIds": [
        "effect.pf_001.01"
      ]
    },
    {
      "id": "pf_002",
      "designId": "PF-002",
      "contentVersion": 41,
      "collectible": true,
      "manualPlayAllowed": true,
      "nameKey": "card.pf_002.name",
      "rulesTextKey": "card.pf_002.rules",
      "factionId": "plains_forest",
      "themeId": "plains_forest",
      "rarity": "COMMON",
      "cardType": "UNIT",
      "cost": 2,
      "hasAttack": true,
      "attack": 2,
      "hasHealth": true,
      "health": 3,
      "hasDurability": false,
      "durability": 0,
      "buildingSlots": 0,
      "artKey": "card_art.pf_002",
      "tags": [
        "animal"
      ],
      "keywords": [],
      "hasCraftingRecipe": false,
      "recipeId": "",
      "craftingRecipe": [],
      "craftedAttackBonus": 0,
      "craftedHealthBonus": 0,
      "craftedDurabilityBonus": 0,
      "effectImplementationStatus": "IMPLEMENTED",
      "effectIds": [
        "effect.pf_002.01"
      ]
    },
    {
      "id": "pf_003",
      "designId": "PF-003",
      "contentVersion": 41,
      "collectible": true,
      "manualPlayAllowed": true,
      "nameKey": "card.pf_003.name",
      "rulesTextKey": "card.pf_003.rules",
      "factionId": "plains_forest",
      "themeId": "plains_forest",
      "rarity": "COMMON",
      "cardType": "UNIT",
      "cost": 2,
      "hasAttack": true,
      "attack": 3,
      "hasHealth": true,
      "health": 2,
      "hasDurability": false,
      "durability": 0,
      "buildingSlots": 0,
      "artKey": "card_art.pf_003",
      "tags": [
        "animal"
      ],
      "keywords": [],
      "hasCraftingRecipe": false,
      "recipeId": "",
      "craftingRecipe": [],
      "craftedAttackBonus": 0,
      "craftedHealthBonus": 0,
      "craftedDurabilityBonus": 0,
      "effectImplementationStatus": "IMPLEMENTED",
      "effectIds": [
        "effect.pf_003.01"
      ]
    },
    {
      "id": "pf_004",
      "designId": "PF-004",
      "contentVersion": 41,
      "collectible": true,
      "manualPlayAllowed": true,
      "nameKey": "card.pf_004.name",
      "rulesTextKey": "card.pf_004.rules",
      "factionId": "plains_forest",
      "themeId": "plains_forest",
      "rarity": "RARE",
      "cardType": "UNIT",
      "cost": 3,
      "hasAttack": true,
      "attack": 2,
      "hasHealth": true,
      "health": 4,
      "hasDurability": false,
      "durability": 0,
      "buildingSlots": 0,
      "artKey": "card_art.pf_004",
      "tags": [
        "villager",
        "trade"
      ],
      "keywords": [],
      "hasCraftingRecipe": false,
      "recipeId": "",
      "craftingRecipe": [],
      "craftedAttackBonus": 0,
      "craftedHealthBonus": 0,
      "craftedDurabilityBonus": 0,
      "effectImplementationStatus": "IMPLEMENTED",
      "effectIds": [
        "effect.pf_004.01"
      ]
    },
    {
      "id": "pf_005",
      "designId": "PF-005",
      "contentVersion": 41,
      "collectible": true,
      "manualPlayAllowed": true,
      "nameKey": "card.pf_005.name",
      "rulesTextKey": "card.pf_005.rules",
      "factionId": "plains_forest",
      "themeId": "plains_forest",
      "rarity": "RARE",
      "cardType": "BUILDING",
      "cost": 2,
      "hasAttack": false,
      "attack": 0,
      "hasHealth": true,
      "health": 4,
      "hasDurability": false,
      "durability": 0,
      "buildingSlots": 1,
      "artKey": "card_art.pf_005",
      "tags": [
        "plant",
        "production"
      ],
      "keywords": [],
      "hasCraftingRecipe": false,
      "recipeId": "",
      "craftingRecipe": [],
      "craftedAttackBonus": 0,
      "craftedHealthBonus": 0,
      "craftedDurabilityBonus": 0,
      "effectImplementationStatus": "IMPLEMENTED",
      "effectIds": [
        "effect.pf_005.01"
      ]
    },
    {
      "id": "pf_006",
      "designId": "PF-006",
      "contentVersion": 41,
      "collectible": true,
      "manualPlayAllowed": true,
      "nameKey": "card.pf_006.name",
      "rulesTextKey": "card.pf_006.rules",
      "factionId": "plains_forest",
      "themeId": "plains_forest",
      "rarity": "RARE",
      "cardType": "SPELL",
      "cost": 3,
      "hasAttack": false,
      "attack": 0,
      "hasHealth": false,
      "health": 0,
      "hasDurability": false,
      "durability": 0,
      "buildingSlots": 0,
      "artKey": "card_art.pf_006",
      "tags": [
        "breeding",
        "nature"
      ],
      "keywords": [],
      "hasCraftingRecipe": false,
      "recipeId": "",
      "craftingRecipe": [],
      "craftedAttackBonus": 0,
      "craftedHealthBonus": 0,
      "craftedDurabilityBonus": 0,
      "effectImplementationStatus": "IMPLEMENTED",
      "effectIds": [
        "effect.pf_006.01"
      ]
    },
    {
      "id": "pf_007",
      "designId": "PF-007",
      "contentVersion": 41,
      "collectible": true,
      "manualPlayAllowed": true,
      "nameKey": "card.pf_007.name",
      "rulesTextKey": "card.pf_007.rules",
      "factionId": "plains_forest",
      "themeId": "plains_forest",
      "rarity": "EPIC",
      "cardType": "SPELL",
      "cost": 4,
      "hasAttack": false,
      "attack": 0,
      "hasHealth": false,
      "health": 0,
      "hasDurability": false,
      "durability": 0,
      "buildingSlots": 0,
      "artKey": "card_art.pf_007",
      "tags": [
        "nature"
      ],
      "keywords": [],
      "hasCraftingRecipe": false,
      "recipeId": "",
      "craftingRecipe": [],
      "craftedAttackBonus": 0,
      "craftedHealthBonus": 0,
      "craftedDurabilityBonus": 0,
      "effectImplementationStatus": "IMPLEMENTED",
      "effectIds": [
        "effect.pf_007.01"
      ]
    },
    {
      "id": "pf_008",
      "designId": "PF-008",
      "contentVersion": 41,
      "collectible": true,
      "manualPlayAllowed": true,
      "nameKey": "card.pf_008.name",
      "rulesTextKey": "card.pf_008.rules",
      "factionId": "plains_forest",
      "themeId": "plains_forest",
      "rarity": "LEGENDARY",
      "cardType": "UNIT",
      "cost": 6,
      "hasAttack": true,
      "attack": 5,
      "hasHealth": true,
      "health": 7,
      "hasDurability": false,
      "durability": 0,
      "buildingSlots": 0,
      "artKey": "card_art.pf_008",
      "tags": [
        "golem"
      ],
      "keywords": [
        "TAUNT"
      ],
      "hasCraftingRecipe": false,
      "recipeId": "",
      "craftingRecipe": [],
      "craftedAttackBonus": 0,
      "craftedHealthBonus": 0,
      "craftedDurabilityBonus": 0,
      "effectImplementationStatus": "IMPLEMENTED",
      "effectIds": [
        "effect.pf_008.01"
      ]
    },
    {
      "id": "db_001",
      "designId": "DB-001",
      "contentVersion": 41,
      "collectible": true,
      "manualPlayAllowed": true,
      "nameKey": "card.db_001.name",
      "rulesTextKey": "card.db_001.rules",
      "factionId": "desert_badlands",
      "themeId": "desert_badlands",
      "rarity": "COMMON",
      "cardType": "UNIT",
      "cost": 1,
      "hasAttack": true,
      "attack": 2,
      "hasHealth": true,
      "health": 1,
      "hasDurability": false,
      "durability": 0,
      "buildingSlots": 0,
      "artKey": "card_art.db_001",
      "tags": [
        "undead",
        "zombie"
      ],
      "keywords": [],
      "hasCraftingRecipe": false,
      "recipeId": "",
      "craftingRecipe": [],
      "craftedAttackBonus": 0,
      "craftedHealthBonus": 0,
      "craftedDurabilityBonus": 0,
      "effectImplementationStatus": "IMPLEMENTED",
      "effectIds": [
        "effect.db_001.01"
      ]
    },
    {
      "id": "db_002",
      "designId": "DB-002",
      "contentVersion": 41,
      "collectible": true,
      "manualPlayAllowed": true,
      "nameKey": "card.db_002.name",
      "rulesTextKey": "card.db_002.rules",
      "factionId": "desert_badlands",
      "themeId": "desert_badlands",
      "rarity": "COMMON",
      "cardType": "MATERIAL",
      "cost": 1,
      "hasAttack": false,
      "attack": 0,
      "hasHealth": false,
      "health": 0,
      "hasDurability": false,
      "durability": 0,
      "buildingSlots": 0,
      "artKey": "card_art.db_002",
      "tags": [
        "archaeology",
        "material"
      ],
      "keywords": [],
      "hasCraftingRecipe": false,
      "recipeId": "",
      "craftingRecipe": [],
      "craftedAttackBonus": 0,
      "craftedHealthBonus": 0,
      "craftedDurabilityBonus": 0,
      "effectImplementationStatus": "IMPLEMENTED",
      "effectIds": [
        "effect.db_002.01"
      ]
    },
    {
      "id": "db_003",
      "designId": "DB-003",
      "contentVersion": 41,
      "collectible": true,
      "manualPlayAllowed": true,
      "nameKey": "card.db_003.name",
      "rulesTextKey": "card.db_003.rules",
      "factionId": "desert_badlands",
      "themeId": "desert_badlands",
      "rarity": "COMMON",
      "cardType": "UNIT",
      "cost": 2,
      "hasAttack": true,
      "attack": 2,